Review,Rating
"As always this guide explain with pictures and good tips how to work in your bike. It tell you the degree of difficulty of each work from novice to experts, tools you need, specs history and more. A must!",5.0
"As a novice MC mechanic, this is a great source of detailed information.  I have already used it and am sure to many more times.",5.0
Good manual. Just what I needed. I would order it again. And this silly site requires me to write a certain number of words for a review. Who came up with that?,5.0
"covers the bikes listed in the description, also gives some coverage to older models. a good resource for the DIY, or if you want to start learning about your bike and how to take care and work on it. between this manual and youtube, this is nothing I have wanted to do that I have not been able to very very easily.",5.0
Great book and a necessity for a well stocked garage. Great photos with plenty of detail and written with clarity.,5.0
"Well written, must have for maintenance.  Includes all torque values, electrical diagrams, etc.  Great for routine maintenance tasks such as oil changes, etc.",5.0
We bought this for a friend. He was very pleased to receive this Triumph : Bonneville book! It came in handy when he needed help for his motorcycle!!,5.0
I choose the rating based on Value and fast shipping. I really needed a manual for my Triumph and this fits the bill. It is a hardcover and will last a long time with constant use.,5.0
"This is the book you have to have. I had to re-tune my bike (1978 KZ650D SR) for 11,000+ feet in Colorado. The previous owner messed with everything and had no idea what he was doing. In order to get the carbs back to square-one I had to have this book. Plenty of good info, advice and pictures.",5.0
Was told by the inmates on ADV forum to buy this map.  It is awesome!,5.0
nice map would buy from again,5.0
great map for old school navigation.  Used it often when the Garmin ZUMO was giving strange directions.,5.0
So many places to go.,5.0
Great heavy weight material! That GPS might not always work. Great keep sake too. Beautifully designed and easy to read.,5.0
Love it!,5.0
Great,5.0
"Very nice map!  I used to when I went to Nor Cal (obviously).  I love the GPS tags that show you where the good roads are.  These came in handy so much that I wish they had more scattered throughout the map, especially the beginning and ending of the dirt roads.  Not big deal as there are ways around this with a Garmin and/or Cell phone.  The print can be small at times but it never inhibited the map in any way.  I found it was easier to do research with this map than use it on the open road, but I did both.  Yellow, red, and orange routes were as described!",5.0
find the best,5.0
Convenient on my Keychain and is secured by a good strong magnet (which can also be used for identifying ferrous materials when the pen is removed}.,5.0
"This a phenomenal little emergency pen. The build quality is rock solid--it's a little tube of stainless steel. The magnetic cap is plenty strong. I keep it on my key chain, and the pen has never once come loose or fallen off. The magnet is strong enough to give you a very satisfying snap when you insert or remove the pen. Inadvertently detaching the pen is quite unlikely. At under 3 inches long, it fits nicely in my key chain with my car keys. You can use any standard multi-pen refill. I use Fisher Space Pen U1F or U4F universal refills.

----------------------
EDIT: March 15, 2016

So this is still the best tiny keychain pen. The magnetization on the cap is strong and solid, and the pen is shorter than my car key. However, there are a few changes to the design since I last ordered this pen in late 2014. These details are noted below and in the pictures that I have uploaded.

First, the picopen has increased in length from a bit over 3"" to now a bit over 3.25"". In addition, the thickness of the pen has increased from what used to be approximately the thickness of a standard USB cable to what is now just shy of the thickness of a 6.35 mm audio jack... or a little bit bigger than the grounding prong of a three-prong electrical plug (sorry, I don't have a caliper handy for better measurements).

Second, the design of the top of the pen has changed slightly. As can be seen in my pictures, the older Picopen had a tiny lip at the top of the pen, where it connected with the cap. The newer design is a smooth cylinder.

Third, the cap design has changed quite substantially. In the older design, a magnet was attached just inside the cap rather shallowly. When you put the cap onto the pen, the magnet inside the cap gripped onto the lip of the pen (see pictures). With the newer design, the cap is nearly twice as long, and the magnet is recessed much deeper within the cap. Because of the recessed design, the newer cap slides down the shaft of the pen nearly a quarter inch more. Also, as far as I can tell, the magnet on the newer pen is a fair bit stronger than on the old pen. These design choices make it much less likely for the pen to accidentally become detached and fall off your keychain (though that never was a problem for me with the old pen).

Fourth, the mechanism for gripping the ink refill has changed on the new pen. On the old pen, the refill just slides in. It's a lightly firm fit, but it feels as though you're just sliding the ink refill into a cylindrical metal tube. You slide the refill in all the way until it hits the back of the pen and stops. The new pen is quite a bit different. Though I am unable to see inside the shaft of the new pen, it feels as though there is a spring that grips the ink refill as you slide it in. The spring resists the ink refill from going into the pen shaft at the very top, but once you have the refill in a little bit, it slides in very firmly. When the ink refill is inserted all the way, pushing on the top of the refill reveals a little bit of springiness. I'm sure everyone has used a retractable pen at some point in their life that, when they press down on a piece of paper, the ink refill has a very small amount of give/springiness. The new Picopen is like that, whereas the refill in the old Picopen is rock solid and has no give. I assume there is probably a small spring underneath of the ink refill that you compress as you push it in which causes this.

Fifth, as mentioned above, I use Fisher Space Pen U1F/U4F pressurized refills for my Picopen. Even though the U1F/U4F are standard multipen sizes and are almost exactly the same size as the ink refill that comes with the Picopen, the refill gripping mechanism in the new Picopen strongly resists accepting the Fisher refills. You have to wiggle and push the Fisher refills pretty hard to get them past the initial resistance of the new Picopen before they will slide in, and as you do so, it feels as though you might break whatever spring is inside of the new Picopen. Perhaps this problem will fade with time as you put some wear and tear on the new Picopen. I suspect that reason for the difficulty in getting the Fisher pen refills into the new Picopen is because the tip of the Fisher refills are capped--since they're pressurized--whereas the ink refill that comes with the Picopen has a hollow end (see pictures).",5.0
I really like this pen! I wasn't sure it would be useful at first but I've already been through two refills (cross 8518-4). Twice in the past two years the pen has gotten separated from the top while removing it from my pockets but so far I'm 100% lucky in noticing immediately and finding it.,5.0
"Great product. Its my everyday carry pen. Instead of putting it on my keys, I hang it on a zipper pocket. I just pull down instead pen. Now I can jot something down whenever. Not sure, how to change the ink. Like the product.",5.0
"People I've given these to love them. Too expensive to buy for myself. The pen really stays in the cap, and it comes out easily when you want it.",5.0
"Absolutely perfect pocket pen, in a pinch.  You wouldn't want to write with this little beauty for long periods of time, unless you've got very small hands (I've tried).  But in a pinch, it does a fantastic job.  It's an indispensable addition to any keychain.  ""Waiter, do you happen to have a pen?  We've got our check but we just need something to sign it with."" (Only to wait for what feels like forever)  - Me before my new PicoPen.",5.0
"I loved this pen (yes, past tense) because although the magnet worked pretty good, unfortunately not good enough!
I went to use it one time and it was gone, I guess the magnet let go. Kind of expensive to keep replacing so it lasted about 1 month before it disappeared, big bummer.",5.0
I am the most forgetful when it comes to pens so this is perfect and barely noticeable on my minimal key chain,5.0
"great, in my wallet but tsa still doesnt know what it is. always and issue. Top should fasten to body when using it, almost lost it.",5.0
Cool pen,5.0
Great!!!,5.0
"So far, after several month on my key chain, all is good. I've used the pen a few times, but mostly I use it to spin my keys around for fun. I did install a Fisher pressurized ink cartridge so I could write upside down under whipped cream.

UPDATE 3/15/2017- Thought I lost the pen, but found it in my car's trunk. The Fisher refill is DEFINITELY the way to go. The original ink cartridge failed a few times too many. The Fisher always works 100%",5.0
"Too many times I found myself needing a pen and there was none in sight.  Picopen solved that problem.  It's light, tiny, and attaches to one's keychain.  The pen itself is attached to its cap magnetically and securely.  This is a well made product that serves my need.  I highly recommend it.",5.0
This is a must have if you are working on a car. If you own a car this should be your first investment whether you are going to work on it or not.,5.0
The item arrived quickly and I was able to use the manual to help fix the 1995 Toyota Tercel.  The manual doesn't exactly cover that year but the info is pertinent.  The manual helps when trying to troubleshoot a problem.  The book was clean and arrived in good condition.,5.0
Has an index of ideal equipment to keep. Depicts engine and individual parts. Shows where to locate the parts and their names. Never to be blindsided any more. It portraits scenarios and possible solutions. Just perfect.,5.0
"PROS

1) This manual helps with small repairs that can cost over $100 if you were to take it to a mechanic.
2) It gives you several tips on how to have your car running at its best.
3) It contains many details that will help the average person.
4) It is a good compliment to the genuine Nissan Sentra service manual (look it up, especially on eBay).

CONS

1) The pictures are only in black and white, except for the pictures on the front and back cover of the book.
2) The manual is from 1999. So, it has not been updated for possible errors or improvements.",5.0
This book has helped me out a lot. It is truly something every car owner should have.,5.0
"1st class service, got my book in a reasonable time period. I would use this service again.",5.0
"I done a lot of mechanical work on my Saturn, Thanks to this book, Good info and a good price!
Thanks,
C.A. of St. Louis, MO",5.0
"This manual is great.  Very simple to understand ""how to"" fix your Saturn.

Very pleased.",5.0
What ever you need to know is  in here. Fast service,5.0
In great shape and saved me a lot of time.,5.0
"Fast shipping, product as described.",5.0
Very Good,5.0
"I am pleasantly surprised by how much this book has helped me on my Saturn SL1 (1999) project. I had to remove the PCM and the book showed me how to take the upper dashboard off to reveal the PCM right in easy reach, Without the book I would have had a problem.",5.0
This book was shipped with out delay and was in good condition.  For use as a repair guide this is as good as new.,5.0
I was doing a engine rebuilt and I needed it for the torque pattern and the torque down steps for the head bolts. No torn pages and still plastic wrapped.,5.0
"Most of these guides are between 20 and 30 dollars.  This was a fraction of the cost, and it was still in superb condition.  No pages were missing, and everything was clean and clear to read.",5.0
Setup to find solutions for any on going problem with this vehicle. Great for the novice to the well seasoned.,5.0
For taking off the door panels there is no instruction on how to take off the window roller and how to take off the inner doorhandle was not according to the sl2 99. I figured it out. Rest of book looks fine. Hopefully i won't run into more problems,5.0
"I've saved hundreds of $$ by following the directions in this manual and doing my own repairs to my 1994 Saturn SL1. In a few cases, I'd have like to have more photos, but the directions for every procedure are clear and correct.",5.0
Exactly what I wanted and paid for and is working great for removing the transmission is my saturn. I am every pleased.,5.0
great book i love it,5.0
:),5.0
Nice start for a beginning welder.,5.0
Good book to learn the basics of welding-Excellent price,5.0
great tune up for welding skills,5.0
great,5.0
exactly what i was looking for,5.0
Great //(*_*)\\ To: Deal With -  <> A+ A + A+ - lgtec,5.0
"This book includes all types of welding and cutting that someone would do.
This book is good for the hobby welder.",5.0
"What can I say, Now I can weld - I'm not the best welder, but my welds are solid.
I inherited an oxyacetlene set with all sorts of hoses, gauges, tips and valves.
 The book covered the basics and when I had questions, it had answers.
If one of my kids wants to know about welding, Ill buy another copy for them. This one's mine.",5.0
"Great help when I repair my Dodge Intrepid, The pictures and the text are easy to follow and very accurate",5.0
"It is great...shows me a lot  and saves me money.....Chrysler LHS, Concorde, 300M & Dodge Intrepid, '98'00 (Haynes Automotive Repair Manual Series)",5.0
Bought this for my husband who is a do-it-yourself person with respect to anything and everything.  He says this is a very good book for the do-it-yourself or the learn to do-it-yourself person!,5.0
"Need assistance in keeping your car alive?  Buy the book, consult you local dealer for free repair advice and you're on your way.  Good luck!",5.0
I have Haynes for all cars that I own and that saved me a lot of money.,5.0
"Thank you so much for the fast delivery on the book.  We shopped locally, but book was not available.  I think it only took 2 days for us to receive by mail. Thank you so much!!!",5.0
"i am having problems with my windsheil washer,i cannot find it in the manuel. i replaced the pump but it is not working, i am getting a 12 volts steady current please help
 and i am getting poor heating in my car please help me
 1995 nissan altima gxe
thank you for your kindness
god bless you
naipaul",5.0
Yes you can find almost all the information in this book on the internet but it is a really nice reference text to have. I was new to AC repair and this book helped give me the confidence to repair my cars AC. It definitely paid for itself.,5.0
Had everything I needed to know in this book. And book was as discretion,5.0
The book is written in layman terms that the ordinary person is able to comprehend the material.  This book makes it easier for the homeowner mechanic to fix his own motor vehicle.,5.0
"This was actually a replacement for the exact same book.  Somehow, the first book got damaged and I chose to replace it.  It is an excellent technical manual.",5.0
this book works great for the home repairman and it is pretty good info and antone can read it and understand it,5.0
Love these manuals and this a/c book is just another good diy for those interested in a/c.  Easy to understand.,5.0
I hadn't worked on old vehicles for a while so this was helpful.  The price was right and it gave me the basics to do a $600 repair job for $50.,5.0
Great book with a lot of very useful information about the air conditioning system system in general.  And the charts in the last part of the book with specifications where great.,5.0
if its the fundamentals of refrigeration and how it is incorperated into an automobile that you truly want to understand this the book for you. it helps to be mechanically inclined but even that is not neccessarily required if you have a good interest.i can't think of a better way to present this knowledge-good job haynes!!,5.0
Manual is very helpful and provides much understanding into the workings of automobile air conditionong systems and repairs. I recommend this manual for anybody including DIY's.,5.0
"the item haynes automotive heating and air conditioning are good,explain very good step by step,if anyone have same rrelationship with htis area im sure can understand easy,and the price is the best deal thank so much",5.0
The book contained the info I needed to use the gauge set and vacuum pump I recently purchased.  Physical condition of the book was quite good as well.,5.0
"I got more than enough info about my 70s era AC system to ID parts and understand what the parts were and how they do what they do. This has made me confident enough now to seek further info on upgrading my system to modern standards and chemicals. Good job haynes. Several people have complained about this manual not having much info about newer ac systems but I found that before I tried to upgrade I had to know what I was upgrading from.
UPDATE- I found someone with this same book but their version does not contain the updates mine does on newer ac systems. I imagine that now only the updated versions are sold but who knows. This may be why some people have complained about the book being outdated.",5.0
Purchased for our son as he needed some repairs done.  These books are slways helpful espevially the schematic and othrr diagramd.  Saved us quite a bit of money as we took care of some of the repairs ourselves..,5.0
Everything you need to work on this car,5.0
I have bought and used these manuals on several different brand of different they are always good.,5.0
"great condition, Thank You.!!",5.0
"Nissan Altima Automotive Repair Manual: Models Covered : All Nissan Altima..., the perfect tech help when you are DIY repairman, I would definitely order from this company again, thank you",5.0
Arrived quick as promised. It didn't have any oil or dirt smudges.  Just like a new book except for the pages slightly yellowed which is to be expected for a book like this that is over 10 yrs old.,5.0
"This book is great for the do-it-yourselfer. I own a 2000 Nissan Altima and I enjoy saving money so I try to fix my car when ever I am able too.  When I came across this book online, I knew that it was just what I needed, and boy was I right.  Every part that you can think of inside your car is in this book and tells you the best way to get the job done.",5.0
Manual has left out information on heater hose repair that is around bottom of motor between engine and firewall passenger side. Hard to get to. Also fender replacing for both sides for front.,5.0
"I get one of these for every vehicle I purchase and let me tell you, they make any person with little to no knowledge on how to work on vehicles an expert in what needs to be done to fix your vehicles problem.  Some things need special tools and require a certified mechanic but changing oil, spark plugs, brakes, bleeding your brake lines, etc., that you would typically bring your vehicle to a mechanic for and pay out the wazoo, you get a picture by picture tutorial on how to do it yourself (if you have the time) and save big money (and boost your self esteem).",5.0
I like the pictures that show what everything should look like and where it should be located. I also appreciate the detailed explanations in the How-To instructions.,5.0
I have bought these manuals for other cars.  This one was very helpful for the projects I was working on.,5.0
"I have owned my '99 Silhouette Van for almost 8 years.  I am to the point now that I am not willing to pay $60 plus per hour to have someone else fix minor issues with it.  Since purchasing the manual, I have replaced the driver side mirror and vent speed controller.  Mirror was $35 and the controller $18.  Both took some time and effort (particularly the vent controller) to replace.  I am guessing the manual has saved me $300 or more in labor costs plus tax.

Who is this manual good for?  On a scale of 1 to 10 with 1 being Novice and 10 being Expert, I would say a solid 5.  The manual spells out several procedures that most people might not be able to undertake such as changing the spark plugs (have to rotate the engine - not going to happen in my garage).  But, overall, if you pre-read the procedures and take your time, you can accomplish most tasks found in the manual.",5.0
"These Haynes manuals are great. Husband swears by them. If you need to have a how to manual this is your book much better than the old Chiltons. No longer own this vehicle but was a welcomed addition as the old van started going to pot before getting rid of it after 228,000 miles.",5.0
"Received as stated, ""very good"" condition with all the information we  needed!",5.0
"Haynes always makes great manuals. Easy to read, easy to follow.",5.0
"I started to buy this manual at a local parts store. But instead I purchased this gently used manual,for a great price. It is in excellent condition. Great deal.",5.0
"i bought this for my wifes 01 Pontiac Montana. she hates that car and wants me to buy her a new one. being the good husband that i am, i just won't do it. i just keep fixing it. its the meanest prank that keeps on going. and this manual has helped me through it. so far it has helped me, change the water pump, starter, flush cooling system, change the alternator, replace head gasket, upper intake gasket, exhaust gasket, pretty much you name it, ive fixed it. i couldn't have done it without this book.",5.0
We have an old van and it needs to be worked on every once in awhile. This repair manual has helped us save a lot of money.,5.0
Great! Same book much cheaper price!  Condition of the book was as stated. Arrived quickly. Afford me the ability to do repairs on my own or with my husband and save on labor prices that mechanics charge.,5.0
I needed a manual for my 2001 Chevrolet Venture Van as I was replacing some of the original parts in my van and needed the correct parts for I could ordered them or buy them from a salvage yard and be able to installed them.,5.0
Bought for 1997 Isuzu Trooper. Should work for all my repairs and maintenance that to keep the vehicle running as long as possible.,5.0
"Not a shop manual, but good for the price. Covers a lot of information. good stuff. I have owned many of the Haynes manuals and they really help.",5.0
"The seller packed this VERY well, and the condition was better than I had been led to expect.  I received it quickly, and it is a very handy guide to repairs on my Honda Passport.  All in all, this purchase has been well worth it.",5.0
thank you the manual came in great condition and when promised. :) great seller,5.0
Hopefully this manual will help my son do minor repairs on his new Explorer.,5.0
"Haynes Repair Manual's are the only books you'll ever need for your vehicle, and this one is just as useful. I couldn't live without this book. Even though I hardly ever needed it, it was a god send when I did. Stuck on the side of the road with no idea why? This is the book that might just help you out...",5.0
"Just needed to have a book for this old truck, this will do the trick.",5.0
"Almost new and a faction of the price, thanks I needed that break:)",5.0
great information on our car,5.0
It covers many Explorer models and is a little less complete than I expected but the price/condition/shipping cost was EXCELLENT!,5.0
Thank you!,5.0
It's the book in the picture,5.0
just what I needed thanks,5.0
Love it was as said it would be a fraction of the cost of a new one.,5.0
"You can learn a lot watching bike mechanics ""operate"".  You can learn what tools to use, and how to apply them, and what pieces fall out when you take something apart.  But who has time to hang around a bike shop?  Wouldn't it be nice to have a book that shows you what to expect, and how to deal with it?  This is it, in Technicolor glory.
Every page of this book has clear color photos showing exactly what to do.  The book is broken down by chapters for the various mechanical systems of the bicycle.  Each chapter goes through the various technologies in use.  (Example: five kinds of brakes.)  Each one is ripped apart and put back together with you.  Each chapter has a section on what tools you will need (and recommendations on saving money).
Haynes is famous for automobile and motorcycle repair books, and this is even better than those: All photos are in color, the steps are broken down and illustrated clearly, with the use of tools shown explicitly.  (This is not always the case with the automotive books, which assume a certain proficiency with mechanic's tools.)  Very nicely done.  I hope they update it periodically as bicycle technology evolves.",5.0
"The best book for bike repair and maintenace I've ever had.  Good, clear  text and photos made it easy for me to understnad what to do and why. It  enabled me to completely overhaul my bike last winter, and now it rides  great! Don't leave home without this one. It's the biker's best tool.",5.0
I needed this and it was at a good price,5.0
must have for any backyard mechanic to help figure out what is wrong or how to replace or repair certain parts,5.0
The 2001 Mercury Grand Marquis Shop manual has all of the data and details I have needed to repair brakes and electrical switches. Since Chilton manuals for the full size Fords aren't easily found this was a good buy,5.0
A must have...,5.0
Very good,5.0
Book was in good shape and I liked the thank you note for buying the book.,5.0
