Review,Rating
"Perfect fit for the little f150.  I could not get this battery anywhere in my town, and the closest town was about 1.5 hours away, so amazon was awesome for offering this.",5.0
Just what I needed,5.0
all went well. actually got it earlier than projected..  battery works just fine...,5.0
"Everything was as expected.  Battery works great,  delivery was on time.",5.0
Awesome and great price!,5.0
Works great.,5.0
Works great - very pleased.,5.0
It works!,5.0
These batteries make the children's power toys go.,5.0
Bought this for my kids power wheels and it worked like it should.. Also alot cheaper then i was finding at any store around me!!,5.0
Good,5.0
"My little pink car has its ""vroom"" back!",5.0
Thank you!,5.0
"Batteries were exactly as ordered. Much cheaper than in a big box store. The plugs did not fit my late 80s power wheels however I found out they had been recalled. A quick call to Mattell and I was directed to a service center for rewiring. Now my 3 year old drives my old toys 20 plus years later.

On a full charge the batteries last 30-40 minutes of continuous use.",5.0
Just what I needed at a great price!,5.0
It works great,5.0
"our old battery lasted about 5 years, so it was time to buy a fresh one. once this came in we tossed it on the charger over night and the 150 rove like new again. great price for a great product.",5.0
Good deal,5.0
"The battery fit and it works fine.  The ""jeep"" runs like new.",5.0
Works,5.0
"Great price (1/2 Toys -r us) and great delivery, thanks",5.0
Worked great.  Charged just like it should.,5.0
"I picked up a Power-Wheels F150 (http://www.fisher-price.com/en_US/brands/powerwheels/products/Power-Wheels-Ford-F-150-C3493) from Goodwill for $15.

After calling PowerWheels (800-348-0751) and providing them the approprite model number of the truck, they verified this was the correct battery.

Do your homework, there are a lot of configurations out there.  It's not the seller's fault for selling you an item you purchased incorrectly.

This battery charges great and holds the charge great.  My grandkids get tons of fun from this!",5.0
arrived quickly and was exactly what we needed to get an older model power wheels jeep running again!,5.0
Great price and fast delivery.,5.0
great,5.0
"Perfect replacement for the previous power wheels battery that I had.  Charged it up when I received it, plugged it in the next day and the car was off.  Would definitely recommend this to anyone who needs a replacement battery.",5.0
Good quality battery and lasts a long time,5.0
Fits in our Jeep and now we have a Power Wheels that is constantly cruising up and down the sidewalk!,5.0
Worked perfectly!!,5.0
"Works great, fast shipping.",5.0
Made a really happy boy fast deliver,5.0
Perfect for my power wheels,5.0
Old one died after not being charged for a few years but the new one is going strong and my son loves being able to use his Lightning McQueen car.,5.0
Works great. Very satisfied,5.0
WORKS AWESOME,5.0
"Mine was green, so wat DIY, amp is better then green one, I cut cable  one from heat and other from bottom, connect cable and Goo...  More....",5.0
Perfect fit.,5.0
Received item quickly.  Came charged and ready to use.,5.0
"Perfect fit, good power",5.0
"Super Fast shipping, Great Item. Thank you.",5.0
Sent in time and works!,5.0
Made an old toy come back to life...,5.0
Great replacement battery at great price.,5.0
Came quickly is working great!,5.0
Very pleased with product provided and service of company.  Will use them again!!,5.0
Perfect,5.0
now my grandkids can enjoy the F150 their parents did,5.0
"I hoping that it was the right one but it wasn't so now I don't know what to do.
the ends on the battery don't fit the end on the jeep.
so I don't know.",5.0
thank you,5.0
"Worked out great, my grandson is once again on the move.",5.0
Excellent! Batteries were perfect.  The power wheel atv is 20 years old. Granddaughter loves it.,5.0
It was just what we needed to make our grandson's Jeep go.  It arrived as expected.,5.0
Same replacement battery as was in a power wheels jeep we bought at a yard sale. Battery life is ok but when I need to replace this one I will look for a larger replacement. My son gets about 20-30minutes of use. Much better than the worn out one that was in it (about 5 minutes fully charged in worn battery),5.0
used this battery to modify my kids jeep.  works great!,5.0
"Arrived on time, works perfect",5.0
Works as described,5.0
expensive.,5.0
We needed a second battery for our sons F150 power wheel. He loves to drive around in the truck and the batteries seem to hold up pretty good!,5.0
The exact item that I needed..,5.0
Fit was right. So far so good!,5.0
"Bought this to replace original 5 year old battery in kids F-150 Power Wheel.
Charged for a good 24 hours before use and got way more power and a lot more time.
We went from 30-45 min with older battery to using the ride for 1-2 hours.",5.0
thank you til next time,5.0
super,5.0
Came in original box. Correct item. Charged well and my kids power wheels has new life.,5.0
works great,5.0
"Great Battery, has plenty of power for my Grandson's Jeep!!!!",5.0
used two of these all summer and they are great and a lot less expensive than all local options.,5.0
I ordered the wrong one. but it was in excellent condtion,5.0
Bought this many months ago and it's still going strong!,5.0
Good value and nice to have a back up.,5.0
Worked perfect and great price,5.0
Exact replacement for a used ride-on toy we purchased.,5.0
"Good batteries , keeps the little car running most of the afternoon.  I bought a few so it last the whole week end.",5.0
Just what the dr. Ordered,5.0
great battery. no issues.,5.0
I need to charge my new batteries so my grandsons can play on their toys.,5.0
My little grandson is happy to be able to drive his McQueen car again!,5.0
Arrived well packaged and undamaged. It was exactly what we were looking for. Our girls have yet to use their jeep a lot because of the weather but it was perfect for the test run we did do :),5.0
Works Great,5.0
"Used on a dual battery barbie jeep and a single battery caterpillar dump truck.  If you have a 6v  powerwheels from the 90's with the white single battery plug or the dual battery plug, the plug needs to be converted to this type of socket.  It's under a recall.  If you call powerwheels they will direct you to a service center to get it updated for free.",5.0
It was delivered exactly on time. After charging for 18 hours as specified... It works great! Thank you!,5.0
This battery charged and worked the first time.,5.0
Great for the Barbie motor vehicle for my niece to play!,5.0
works great.,5.0
Excelent,5.0
This battery is the original and works excellent!!,5.0
Fit and worked perfectly.,5.0
exactLY  aS EXPECTED,5.0
"My little granddaughter had gotten one of the Barbie cars and it's battery was shot, so I found this one and got it to going again and once it was put on, she popped a wheelie and took off with a big smile. Watching her with the car going was priceless !!",5.0
"Great Product, Fast Shipping",5.0
If you are in need of this battery order this one. Purchasing locally would  be a waste of your money.  I think the battery retail stores purchase these batteries through these sites then charge the public extra.,5.0
Kkkkkkk,5.0
Works great,5.0
A++++++++++++. Works like a charm.,5.0
"Battery worked great for my sons lightning McQueen power wheels, only thing was I paid for faster delivery and it still arrived 3 days later than advised on the payment section",5.0
Perfect! Grandaughter loving it,5.0
Works and at a good price,5.0
Restored usefulness of child's Jeep purchased a generation ago.,5.0
Works great!!!!,5.0
Worked great!,5.0
"Battery works great. Seems to last longer than my son's attention span when driving the car. Just a side note, after doing my research, I thought this was the proper replacement battery for the Lightening McQueen car. It is not. The connector didn't match what was on the car. Being a bit handy I was able to make my own connector for both the car and the battery so it wasn't a big problem. Just make sure that this connector matches the one on your car or truck.",5.0
Great deal and match to the original battery.,5.0
"Works great! I was gonna throw our old Barbie jeep away, but I'm glad I just bought a new battery instead. Kids love it!!",5.0
Batteries were easy to install and worked well.,5.0
Worked perfert,5.0
Just what I was looking for!,5.0
Good Price and works great!,5.0
Arrived quickly works great,5.0
Did the job!,5.0
It finally arrived after 2 weeks but when I received my kids were happy. There power wheel works now. Great product,5.0
An OEM product that met my expectations.,5.0
Just as promised!,5.0
Shipment came on time. Battery works fine. Very pleased with the whole process.,5.0
works well.,5.0
Works great! Much cheaper than other batteries and works as well,5.0
Perfect just what I needed fit perfectly,5.0
Batteries were received within days. The kids love to ride their motorcycle.,5.0
works great!,5.0
best price i could find. i bought it for my kids' jeep. it works great but you need to remember to charge it after every use,5.0
"Exactly what i wanted, had to splice connections because i jave an older unit. But I knew that because Item was exactly as described. Runs great now...",5.0
I decided to buy my grandchildren an extra battery for their lightening Mac-queen car so they would have a back up and It's a good thing I did because the old battery would not take a charge. The new battery was reasonably priced and arrived faster than they said it would.  The battery is exactly the same as the one that came with the car. My grandchildren are having fun driving their car all over. THANK YOU so much I would not hesitate to reorder when I need to.,5.0
Item was perfectly described and was exactly what the picture looked like.  The battery performs well and my daughter is riding her hot wheels once again.  Highly recommend this battery if replacing their hot wheels battery.,5.0
"My brother's grandson got a toy backhoe given to him with a worn battery. I searched Amazon and found this one as a perfect fit. After being charged and installation, it worked fine.",5.0
These batteries are great.  I charged as instructed and my grandchild has been riding his toy on and off for over two weeks without having to be recharged.,5.0
Just like new. better than the first one we love it wouldn't buy anywhrere else great great gteat love it,5.0
"This was delivered fast and was in excellent condition. It worked without any trouble, and we have been using it in our sons jeep for a couple months now without any trouble. It has been recharged and ran out and still works great!",5.0
"Fit our Lighting McQueen toddler car the bigger one, works great make sure to change for 18 hours the first time to maximize it full charging potential.",5.0
The perfect replacement battery for my little cousin's toy car. His dad was desperately looking for this battery for weeks and finally ! Thank you.,5.0
Purchased this battery for a used power wheel I found at a garage sale for cheap. Works like a charm and continues to do so because it keeps my grand kids entertained for hours outside when I'm doing yard work!,5.0
This battery fits the larger of the two Lightning McQueen electric cars. It is the exact battery the car came with new. It works great and is a great price!,5.0
The battery holds a great charge and my nephew get hours of fun out of his jeep.  I would purchase this battery again.,5.0
We were able to install this battery and use it very quickly my daughter loves driving her power wheels car,5.0
"This battery worked great, my son is very happy!  If you decided to get this battery you will be pleased.",5.0
I purchased this for a customer not myself so I don;t know how well it worked. I imagine it worked fine since they have not complained.,5.0
"The battery arrived as described and after being charged worked perfectly to the delight of the little boy to whom we gave ""Big Jake"".",5.0
"Bought this at the time I got my sons truck. To charge and have on hand when the battery that came with it would die, but I have never needed it he is done by the time it gets that low.",5.0
"great price, great option to give new life into a hand me down toy. it has been over a year since buying and still going strong. just wish that it did not take so long to re-charge.",5.0
My son has racked up the miles on the original battery and this replacement keeps him going strong. I expect a year of driving out of this one too,5.0
"I was given a Hot Wheels that required two batteries. The stores sell them for over $60 each, that is a high price to pay. I ordered two of them, charged them as required in the box and both worked great. No problems with the condition of them or the manner on how they are used.

I would certainly suggest anyone to buy them from there. They were sold and shipped by amazon, no chances of getting knock offs.",5.0
Had no issues at all with this at all got what I ordered and got it fast thank you for everything!,5.0
"So pleased with purchase.  Battery arrived in a very timely manner and worked perfectly.  All this made for a very happy little boy with his ""tractor.""",5.0
"went to buy this at a local store only to discover the battery was already past the expiration date.  Received this one, gave it a full charge and its works great.",5.0
Works great and the price was excellent. A+++++++++++. Would recommend this product to anyone needing a 6 volt battery. ok,5.0
Very pleased with battery.  Item was exactly as described.  Sorry I am late in sending this but I am having problems with my computer,5.0
"bought as a back up when the main goes dead.  works great, keeps the kids going, and going, and going.",5.0
Battery came quickly and in good condition.  We charged it fully before using it and have recharged it once.  It has worked great and seems to last for quite a long time.  We were given a Power Wheel truck but the battery would only last a few minutes.  We bought this battery for about $30 including shipping and it's like we have a brand new truck.  Well worth it to us!,5.0
Bought my son a little truck from a yard sale.  I drove ok but it lost power fast.  Bought this battery and he's driving all over the place.,5.0
"Works great half the price of batteries plusseveral. For
Charged  up and grandson loves the toy
Would definetly buy again for other rechargeable items",5.0
i needed a battery for a child's four wheeler that I purchased at a garage sale.  The nearest place to purchase was 2 hours away and was expensive.  This battery works great and was half the price even with shipping.  Thanks Amazon.,5.0
"Ordered two for my grandsons power wheels jeep.  Both arrived fully charged and he was off and running.  After several days they were still going but I hooked them up to the charger over-night.  They were fully recharged the next day.  I was very impressed with the fast service we received from Seneca River Trading, Inc. and my grandson thanks them.",5.0
The battery is a perfect replacement part for the Power Wheels original. It arrived quick and in  good condition so after a full charge we were ready to roll.,5.0
"Battery is what's required for the 4 wheeler. Plugs right in and works fine. My 3 year old grandson has no trouble taking it in and out and charging it. It takes over night to fully charge it and he puts it on early in the morning and plays with it on and off most of the day. He has a lot of fun playing with the 4 wheeler. Then he puts it on the charger for the next day. I'm sure if he rode it constantly, it would run down quicker, but I could buy another battery in that case. The price is good. I recommend buying it if you need it.",5.0
"What a difference new batteries made.  Old batteries moved the vehicle at a slow pace, and lasted 10-15 minutes.  Now, it allows for ""wheelies"", and was still going after 45 minute use.",5.0
Bought item to power child's motorized vehicle. Arrived ahead of schedule. Well packaged. Exactly like original battery and works fine. Has a long charge life.,5.0
I couldn't get this battery anywhere else for this price... I will tell everyone and anyone about this purchase... Thanks again,5.0
this was for a power truck I had for my older boys and gave it to my youngest. He is having a ball on his power truck!,5.0
"The battery worked great when I first got it then seemed to not hold the charge. I contacted the seller and he felt it was more than like the charger, not the battery that was not working properly but did approve a return if that is what we wanted. I purchased a new charger and that indeed was the problem.  Seller was great to work with and I would buy from them again!",5.0
"I picked the wrong Battery, so I got a hold of the Company I purchased it from and returned it",5.0
my kids are very happy that their power wheels car works now.  the battery came charged and ready to go  thanks,5.0
"FOrtunately, package still had two batteries as ordered. I plugged them to charger and they charged right away OK. Will put them in Dora the Explorer and test tomorrow. Will throw old battery away, since charger seems to work OK.",5.0
"I ordered the wrong item, due to operators reading error.... But when I noticed Amazon, without questioning or making feel stupid, the battery was un-returnable, but they just credited my account.. WOW! I was so impressed!!",5.0
Make sure you get the right one (6V or 12V) and the right connector. This was a direct replacement for the original battery that died after a few years of use. It works well and holds a good charge. Don't forget to charge your battery after each use and over the winter for longer life.,5.0
Exact replacement with a very good price. I charged it up and it is working fine. The grandson is going to be very happy that he drive his little car again.,5.0
It is everything i would expect out of power wheels battery. It has many hours of life before recharging it,5.0
Had the jeep for my grandkids and the second battery gave out. Wanted to sell the Jeep as the kids had outgrown it. Replaced the battery for $30.00 and then sold the Jeep for $65.00,5.0
"When I received it, it is concave on both sides.  The one I bought originally and another  one since has not been like that.  I emailed the seller and he said he expects it will work fine because all the ones he has are like that.  I read online where other people who have bought concave batteries have not had problems with them.

Update............battery works great!",5.0
Check around for a basttery for my grandaughters electric car and found the Power Wheels 6 volt on line. Lowest price Ifound and the results have been great. So far it performs well and lasts longer between recharges. Great peoduct.,5.0
The battery came much sooner than expected. The price was very reasonable.  My son was very excited to be able to ride his Power Wheels after charging the battery overnight.,5.0
"It worked great and no problem it was in great condition.
I would purchase again. Great value would recommend it.",5.0
On time and replaced our old worn out batteries.  I would buy again.  Charge the batteries first - then they work perfectly.,5.0
These batteries work perfectly in the kids motor cycle. They seem to hold the charge and fit the toy as required. The price was the best I found.,5.0
"ESPECIAL PARA TODOS LOS JUGUETES QUE REQUIEREN BATERIA.
MUY BUENA MARCA.
EXCELENTE PRECIO, MUY ECONOMICO Y DURABLE, SE LOS RECOMIENDO PARA QUIEN TENGA JUGUETES QUE NECESITEN BATERIA A BUEN PRECIO.",5.0
The battery was shipped quickly and worked great !!! I was excited to see it come by mail asap !!!,5.0
"This battery came when it said it would, and it was very easy to install into our older power wheels truck. It worked very well, and my little one was very excited to ride the power wheels that is finally working again!",5.0
"the battery was exactly as described and fit into the car as expected. the price was great and the battery holds the charge for a long time, even sitting idle.",5.0
This battery was purchased to replace the original battery.  It is identical to the original.  It works completely as expected.  I would recommend this product.,5.0
This item was perfect & just what we needed for the older power wheel that was given to us for our grandchildren to use!,5.0
"We bought this batter and the charger to refurbish a ride-on Blue Thunder Monster Truck.  We found the vehicle at a garage sale for $10.  Found the best price on the battery & charger at Amazon.  Also, Amazon had the most clear information as to which charger to purchase with this particular battery.  Happy with purchase and the 4-year old is thrilled with his ride-on toy!",5.0
This battery was a perfect replacement for my son's F-150.  Half the price of one in the store and perfect performance.  Shipped quickly too.,5.0
"After checking the product is named toys stores I decided to purchase over the internet por the price. The quality is excellent, It holds the charge for a long time and the power is great.",5.0
"I bought this for my daughter's power wheel being it has been just sitting. But it doesn't go to the car I have, which stinks. But guess I'll have to look again. But the battery would have been great otherwise.",5.0
"This product is one of many great products I have received from Amazon! It was exactly what I needed, worked just as guaranteed, and shipped to my home in 4 days!",5.0
"I received my order way faster than I expected and it worked very well with my daughter's ten year old four wheeler I am very,very,very satisfied.  Thank you",5.0
"I hate to admit this, but as I was driving to work one morning a gentleman was dragging a Harley Davidson power wheel (PW) to the curb. I have a 2 year old and those PW vehicles can be pretty pricey. So, I stopped and asked if it worked. The man said it did but it needed a battery and batteries for PW are really expensive. Needless to say my next stop was to Amazon, which had the PW battery for far less than I could have bought it any store. Very happy.",5.0
We used this battery in the Disney Pixar Car for my children.  The last battery no longer worked.  The new one worked fine and gets the job done.,5.0
This product arrived quickly and has definitely works multiple charges on it and no change in performance. No issues at all.,5.0
This battery arrived much faster than I thought it would!  It works great and my son is now thrilled to ride his Power Wheels!,5.0
"This Power Wheels 6-Volt Rechargable Battery arrived quickly and in great condition.  We immediately plugged it in to charge it up for the recommended time.  We felt like we were taking a chance somewhat since we were fairly sure it was the battery, but not 100 percent.  Something could be wrong with the F-150 Power Wheel truck also.  So, holding our breath, we plugged it in and it worked.  When my 7 and 3 yr old grandkids come over they ride the truck all over, and I have a 3 yr old living with me, and he likes to go for a drive every day or so.  We try to charge it after every drive as recommended, but did slip up and it almost went dead.  I had to use a tiny power wheel to push it home by myself with a toddler who had not learned to steer.  It's recommended to not let the battery drain.  We recharged the battery again, and it seemed to have even more power.  We did compare the battery to the Fisher Price website to ensure we were getting the right item.  It plugged right in with no problems.  I would totally recommend this battery because the price so far has been the best that I've found.",5.0
My mom asked me to order these for her b/c they were half the price the battery store was going to charger her. She says they work perfectly and a great price too!,5.0
"I get this to replace battery when my son's truck stopped working. I prayed this was the only thing wrong and it worked. It came pretty quickly and the price was a steal, because I was going to buy one at the local discount store and they were $65!!! I would definitely recommend ordering.",5.0
"Bought this for my dad, for the grandkids' Power Wheels cycle whose batteries wouldn't hold a charge anymore.  Also had to replace the charger, which failed.  Don't know if the problems were related, but Grandpa says it's all working now!",5.0
The 6-Volt Rechargeable battery is an Og product happy with purchase. I would definitely buy again if I had too.,5.0
"I was ecstatic when I found these batteries.  Even with shipping, they were still cheaper than I could get at Walmart.  Great deal!",5.0
"THIS WAS THE LAST RESORT TO FIX A RIDING TOY. THE PRODUCT WORKED GREAT AND I SAVED A LOT BUY BUYING IT HERE. NO THE TOY IS WORKING WELL AND SAVED A LOT OF MONEY

]\",5.0
This product came just as advertised. Followed the instructions and the next day my son drove his power wheel until the battery was dead. I was happy to see that it took about 2 hours for it to discharge. I will buy another when this one wears out.,5.0
I had searched many places for this battery.  We have a Power Wheels Jeep that takes 2 batteries.  I was shocked how inexpensive these were through Amazon!  They were just as advertised not generic batteres.  I was really happy with the batteries.  Now I know where to shop next time I need one!,5.0
"Just like the ones at Toys R Us or any toy store but much cheaper!!  Don't buy retail, buy Amazon!",5.0
I purchased this battery for a power wheels car for my grandchilren. I purchased a battery over a year ago and it was not rechargable. This rechargable battery is really works. I'm able to reuse it over and over again. A good purchase.,5.0
This battery was purchased for a Lightning McQueen Power Wheels. It's the correct battery for the large Lightning McQueen ages 3+.,5.0
