Review,Rating
"Has an odd habit of actually rusting bolts, not sure if I actually got a bad can.",1.0
"Goes on like a spray, but dries to a heavy waxy coating. From the appearance, it should work really well.  I'll update this next year when I check for rust.",1.0
"a bit of of challenge to apply evenly despite it being a spray-on process. Corrosion inhibiting... I have no idea, only time will tell. Absolute nightmare: surface-results: sticky and grabby, almost as though it never drys. Neither does it ""polish off"" well - not at all. Inflicted amber color resulting from the product - if it's a visible location and appearance is of any concern, avoid this product on the basis of color alone. Lingering stickiness... dreadful.",1.0
"Overall they're good seats.  After you make a strap for it, after you hunt up some screws that didn't come with it, after you get a snap and a small screw to attached it to the seat, after you fix the cushion that's popped off of the bottom.  All of this will only take about an hour of work in your shop and you'll have a pretty good seat.  I bought an American made seat to avoid all of this hassle.  Come on people, we can do better than this.",1.0
"Great seat, but it is NOT tan, it's beige. Really beige.",1.0
"shipped fast, would not recommend for old gas, i was running some old gas threw generator it was slow to respond when put under load, bought this thinking it would help improve octane , it did not!  in fact i had to keep cleaning fuel filter, every few hrs it would shut down from lack of fuel that would burn. it might be fine as a fuel stabilizer but will not restore old fuel.",1.0
did not last log,1.0
"Did not work! I hooked it to a brand new fully charged battery and after almost 24 hours, it still said, ""Charging"". It never went to maintenance mode. I unhooked it and hooked my other charger/maintainer and it immediately showed ""Charged"". Schumacher used to make quality chargers but I guess they opted for China's cheap labor and low quality standards. I am returning and will purchase a different brand with hopes of getting a product of quality.",1.0
"By naming this product as an ""onboard"" charger I assumed it was made for boats but when it was delivered it clearly said on the package that it was not for boats.",1.0
Only lasted about a year.,1.0
I should send this back! I called twice the company and was told I had to unscrew some nuts or whatever and apply this device permanently. I finally got it onto the battery cables and days and never helped!,1.0
"Upon installation, the unit powered on and then... did nothing. I consulted the manual to verify that all was working as designed, and it checked out. Two lights come on for a few moments, and then off... The manual says: ""Your unit is working properly"" -OK, well the battery is sitting at 11.6 Volts and not charging, so I don't agree. There is no measurable output from the Schumacher Charger. I sent an E-mail to Schumacher, and received an automated reply that I would hear from them within 24 hours. I have had no such luck, and now have a charger that doesn't work and a company that won't communicate.",1.0
Crap charger don't work only keeps the volts up not the amps,1.0
"The though was I wanted to keep my battery charged in my boat, went to take boat out battery was dead, what made me upset the battery was new.",1.0
I used this product for 4 weeks now in my camper. And now have flies in black water holding tank I don't think this product is working,1.0
"suppose to disolve toilet paper, but all it does is clump it up.",1.0
"Purchased this item to use in a portable toilet, as recommended by amazon. Within an hour, I started having a migraine, nausea, and extreme fatigue. I read the back of the bottle, and despite it saying the formula was ""biodegradable"", it made me horribly ill. The odor lingered for hours. This product may work well in RV's, but be very mindful of the risk of illness due the fact that it's Formaldehyde.",1.0
"Better hope you never need warranty service.  Mine never worked right.  It stopped charging a brand new battery on my classic car over the winter, causing the battery to drain completely and it damaged the battery beyond repair.  I called Schumacher to get a warranty replacement.  It has been 2 months and I have not ever seen a replacement.  I called them and nobody knows where the unit it.  I will stick with the other brand with the green tender labels.  I never had one of those fail me.",1.0
has already quite working,1.0
"This charger may be fine as a trickle charger for an already charged battery, at least it did not do any damage when I hooked it up for a few days to my boat battery last winter. However, I have lost all trust in this unit after recently trying to charge a motorcycle battery which had been accidentally drained to about 7.5V. 1.5A would seem perfect to gently charge a motorcycle battery, so I hooked it up for an afternoon. The battery voltage rose to 11V within seconds as expected but when I came back a few hours later the unit was very hot and the battery was back down to seven volts, with a very weak red light on the charger. I tried it a few more times. It would start charging but then 30 seconds later a click could be heard inside the unit, as from a relay, and the voltage would start decreasing again. I borrowed an old-fashioned Sears 4A charger from a friend which charged the battery just fine within a matter of hours and it has been holding a charge ever since, so I know it was not a faulty or shorted battery to blame. Any ""dumb"" trickle charger would have done the job just fine, given enough time. I have lost trust in this unit and its ""automatic"" features.",1.0
"The best price I could find, in my city the lock set was about $70.00 and to try to buy each piece individually was close to 75.00.  This was a great deal and free shipping to boot. I recieved the package in about four days.

The only locking system to have if you own a Uility Trailer.",1.0
"I bought 2 of these, one was dead out if the box and had to be replaced. It died again about 3 months later, the other lasted almost 2 years being used maybe once a month overnight to top off a gas golf cart battery. It died as well. Just but a good charger, do t waste to e with these.",1.0
Just stopped working in the second year.,1.0
Failed in one year,1.0
Failed just after one month's use.  Now I have to deal with attempting a manufacturer's warranty replacement.,1.0
"I would not buy this charger.  I used it for maintaining my boat batteries during winter.  When I initially plug it in and connect it to the battery everything seems fine.  However, later when checked it the red LED is flashing and my battery is completely dead.  At $100 minimum for a marine/deep cycle battery this gets really expensive fast, especially when I need to rely on my battery while on the water.  This has happened multiple times.  There is not indication on-line or in the manual what could cause this behavior.  Also, Schumacher claims it this charger is okay to leave connected while not charging.  This is clearly not true since it drained my large battery to 0 multiple times.  When not powered this charger will drain your battery.  Beware of using this charger.  It is better to just charge you battery and disconnect it than risk drawing it down to 0.",1.0
"Lasted less than a year, I am very disgusted with the quality. Had battery chargers all my life, rarely a problem. I opened up the case and looked inside, expected to see something burned out. Everything appears to be normal inside. Output is .75 volts. Now looking for something similar but lasts more than a year.",1.0
Blew up after charging a brand new motorcycle battery. Used once then returned. Probably got a lemon.,1.0
It failed after 2 weeks. Came out to drive and the battery was dead!,1.0
Crap,1.0
"These are one of the worst quality oil filters on the market, check out the YouTube videos",1.0
"Not a good filter at all.  Recently took apart 5 different makes of oil filters, all similar to this.  After examining them it is apparent that Fram is not what you would think they were.  fram filters have 1/2"" spaces in between the filter bends.  all the rest were nice and tight 18"" or less.  also the over flow valve on the fram is poorly constructed.  most were built in to the filter but frams just sat in there along with the sealing o-ring. still doing the job but not as effectively.  An instructor told me that they put the black grippy stuff on there because it is junk metal and if you try to use a filter wrench it will rip the metal.  I can't confirm that seeing as I used fram filters for a little bit and never used a wrench to remove.  thanks to the black stuff.",1.0
this does not fit 1997 ford explorer xlt 5.0 awd despite the description saying it does,1.0
"Don't buy Fram oil filters . Their quality has fallen through the floor . Did an oil change on my truck using a Fram filter and my pressure  gauge started going haywire and would drop to zero when at idle. Thought it might be the pressure switch. But after checking around on the Web I saw how bad Fram filters are , I decided to do another  oil change and get rid of the  Fram and use a better filter before I started tearing the engine apart. The new filter did the trick. Oil pressure is back to normal . I can't wait till I have some spare time to cut open the Fram and see just how bad it is .",1.0
Does not fit 1996 Ford Bronco 5.8L engine.,1.0
"Regarding quality - get a Fram and, say, a Wix.  Cut both open, and compare each, yourself.  I have, over the years, made a collection of cut-open filters.  I have settled on Baldwin, Mobil 1, Wix .  Price?  With just a few dollars difference, the time in use, and considering the cost of the engine, I am not concerned about a few dollars more or less.  To cut open, I used a hack saw to cut about 1/2 inch from the base plate.  Go ahead, see for yourself!  Be a cut-up!  Consider the filter viewing expense as entertainment, and compare that to what you spend on professional entertainment. The filter ""entertainment"" would be more lasting.  Enjoy!",1.0
Worked once and that was it - really upset with this piece of garbage - and of course no returns nor warranty for this item,1.0
"The oil leak around the rubber gasket, still leak no matter you loosen it or tighten it, I thinks the rubber or the way the rubber housing is bad. It happened on a few cars of mine using the Fram filter, I own a fleet of rental car. Dangerous if you don't catch it early.",1.0
"I bought two of these, one to use on a riding lawnmower and another to use on a Chevy van.  They do not work.  They apply a high 15 volts for a couple of hours then shut off and do not charge any move.  Complete waste of money.  I waited too long to return them, they will go in the trash.  Don't waste your money.",1.0
I thought I was buying the resin not just the pumps. They really should change the picture to avoid confusion.,1.0
Be careful with this product.  It doesn't have a switch to distinguish between different battery types and killed the get battery in my truck.  I disconnected it and charged the battery and haven't had any issues since.  I would strongly recommend you get a batter tender that will do the trick much more safely and effectively.,1.0
"I purchased two of these to have on my diesel truck. I don't drive it much in the winter, so thought that every once in a while I'd charge up the batteries. Problem is, when these aren't plugged in, they back-drain and will eventually kill the batteries dead, causing them to freeze. $300 later, I have new batteries and I've removed both chargers. Don't know if I'll get any money back, but it's worth a try. Don't buy unless you plan to have plugged in quite regularly.",1.0
"Fram has a horrific history of manufacturing oil filters that fail. Their filters leak and do a poor job at filtering impurities. There are websites devoted to discussing oil and oil filters and Fram products are nearly universally criticized and avoided. There are also videos online that investigate Fram oil filters and they are nearly all universally negative.

Purolator, Wix (NAPA), Mann, Mahle, are some quality filters. Fram are the worst filters and you are risking harming your car.",1.0
I ordered this beacuse i wanted to mount unit in my truck I don't use that much. When it came in it does not have mount and never was intended to mount. It has the same model # as advertised but a complete differant style as in photo and description. I sent it back and bought one from local parts store.,1.0
"This product is not a west system kit with activator, rosin, and pumps as shown in the image. This is a misleading product item that the vendor should be made to ship the missing agent activator and rosin. This was sold by DIY a West reseller not WEST. Just the plastic pumps can be purchased for a few dollars at local suppliers and regional suppliers often provide these pumps free to large quantity purchases.",1.0
"It might work once... I  mounted it by the radiator on a frame rail.  Got water logged.  Took it apart to see if it was a loose connection and its cheap enough I didn't care.  Upon opening it, I wondered if it was sealed with water in it (sarcasm off)

Buy at your own risk.",1.0
Lost a lot of material AND TIME AND MONEY due to an improper cure. EAT A BIG ONE PUMPS,1.0
"It is anything but ""heavy duty."" My vinyl is on a boat and is heavily soiled and this product did not touch it. Went with Simple Green, elbow grease and a scrubby and it worked better.",1.0
the charger is gr8 but the packaging realy bad as very very diff 2 open an cut 3 fingers doing it plus 1 finger bad enuff 2 bleed over  an hour!!!!!!!!- would order 2 more but 4 get it- With UPS an pkging !!!!!!!!!,1.0
"Came wet, and became hard after one day",1.0
"This product did nothing to my boat's vinyl white seats. Yes, I followed the instructions. Soap will do a better job than this product. Do not buy this.",1.0
Brand new opened package and it had mold on it,1.0
"Im a car fanatic and for decades I have been using microfiber towels to dry my car after wash. When I saw the advertisement for this product and read some of the positive reviews I decided to order and use it to dry my car. BIG DESAPOINTMENT! The concept of this product is clever but it doesnt perform well compared to a microfiber towel. First of all you barely move it a few inches and it adsorbs the water and it becomes very heavy and tough. I also noticed it leaves a trail of water behind. As a result you need to keep coming back to the same area to ensure its totaly dry. Second of all it cant be used to dry those hard to reach spots on cars like around the headlights, tail lights, door hinges, etc. therefore, when I was done drying my car (which took twice the time compared to when I use a microfiber) I still had to use my regular microfiber towel to ensure these tigh spots were dry. Bottom line: This towel made the process of drying my car longer, tougher, and not as efficient. I will stick with the microfiber towel to dry my vehicle and since I cant return this product I will use it to dry liquid spills around my house.",1.0
It leaves streaks after using. No happy with this product. Doesnt work as advertise,1.0
Weird texture. Doesn't work for cleaning or buffing purposes. Feels like a rubber rag. Not soft at all.,1.0
Does not clean as we expected. we will be returning this item,1.0
"I have bought this brand for YEARS and been totally happy with every purchase. What they don't tell you about this little charger is that if it isn't plugged in to an AC outlet it actually DRAWS power from your battery. The eyelet connections implies you can hook it up and plug it in when you need to and leave it connected to the battery. This is not the case. Had this on my generator battery and it charged perfectly. I unplugged the ac cord and left the charger connection attached to the battery. Came back 3 days later and the battery was completely dead. Used another charger to charge it again and noticed that the red light on the original charger illuminate (it was not connected to ac at this point). When I pulled the other charger off the battery the light stayed on and began to discharge my battery again. If by ""fully automatic"" they mean it will automatically fully discharge your battery, then they are accurate. Very disappointed.",1.0
"Sham indeed! Yes this does absorb water quickly but it also releases water just as quickly on the surface (my car) that it just wiped.  If I do not re-wipe with a terry cloth towel, there will be water streaks. A waste of money.  Will be sending it back.",1.0
Joke of a product. No idea how it has so many great reviews. An old t-shirt does a better job.,1.0
Yucky....I gave it away,1.0
"Plugged it into a less than one year old normally working automotive battery. After leaving it plugged in for 20 hours and over night temperatures of 7F the vehicle would crank but would not start. Hooked up a battery charger I know works, it reported that the battery was at 50%. After leaving the other brand battery charger hooked up for ten minutes the engine cranked and started.

This is a common theme throughout the reviews for this product. Schumacher quality control must be extremely poor. The instructions alluded to the distinct possibility that this unit might be DOA. I will never buy a product from this company again. It seems like sending junk out the door is A-OK with them.

Pay for shipping to return this hunk of junk? And what about my time, installing, removing it and shipping it back?!

Do not buy. Stay very far away unless you like playing the lottery to see if this product will work. I am glad I found out it didn't work before I went overseas for two months and came back home to a dead battery and a charger that was worthless.",1.0
"I bought one of these units to maintain the charge on the battery of one of my automobiles that I drive occasionally.  I foolishly came to depended on it to work properly.  It worked great for about 15 months then it died.  If you buy one of these, I believe it could make a great paper weight...just keep it away from your car.",1.0
"Product made a continuous loud noise when plugged into wall. After various checks and attempts including ""charging"" for over a week, car battery still dead. Since we did not give up on it until after 30 days, we tossed it in garbage rather than attempting to return product with restocking charge and shipping costs.",1.0
"I don't see where this does anything of value!  Please water cleans just as well.  It might protect -- I don't know, but it certainly does not clean!",1.0
"The product shown is mounted with bent clamps that secure it with indentations located to the right on the ""face "" that is shown.

The product received is mounted with two tabs that extend from the rear on the upper and lower sides of the charger.",1.0
"Bought 3 units to sustain a car, truck, and a lawn tractor battery over winter storage months.

All 3 units failed within 3 years.

The quality of this product is poor.

I cannot recommend this product.",1.0
"I tried to use this on my automatic generator. When the generator starts, the charger quits charging and indicates a bad battery.",1.0
i was used to a real chamois cloth which worked well on my flute-- this doesn't,1.0
"I purchased 3 of these units and two of them went bad within a year.  I use them to maintain small tractor batteries.
I have another unit offered by this company that is not sealed that one seems to work well.",1.0
"thought it was junk, tried to return but was to late",1.0
This product is garbage.  Used on my 29 foot cabin cruiser and actually made the boat look worse.  There is no substitute for a real wax job and after using this product I will be rewaxing the boat the right way.  Leaves the boat looking very spotty and streaky.  With that said always been a big Meguiar's guy.  Save youself some time and buy the Meguiars premium wax and do it right the first time.,1.0
Product I received was not read as pictured.  What I received was pink.,1.0
To stiff,1.0
"Seems like it was working good when I bought it, but now I don't like it.  I have had it for almost a year. Does not dry my cars very well, leaves them wet.  I have never found a good substitute to the real chamois.  See the before and after pictures, and that's because my vehicle was not even that wet.  I don't know of it's because of the humid climate I live in, but I never had a problem with the real chamois.  I agree with another reviewer that's it's more like a sponge.",1.0
HORRIBLE!  It's hard as a rock unless it's wet.  I purchased a better one at Advanced Auto & threw this one away!!,1.0
"This product is horrible. Two weeks after  I started using it, it started to smell disgusting. I thought maybe it was the tube that it supposed to be stored in so I cleaned the rag again and wash the tube. A week later the smell is back and my ride had mold spots on it.  Almost the whole rag is covered in spots and it smelled putrid. I followed the menu facture directions to a T. I ended up getting a refund on this item on Amazon told me to rebuy the product. There's no way I'd ever bring this product into my home again. When I walked in the door after a vacation our whole house reeke I followed the menu facture directions to a T. I ended up getting a refund on this item on Amazon told me to rebuy the product. There's no way I'd ever bring this product into my home again. When I walked in the door after a vacation our whole house smeller horrible.  It took me a little while to find where it's coming from but when I did I dumped the product immediately.",1.0
"Asked for purple, got pink.",1.0
"This product is not what claim. It do not give a
Smooth wipe; it like glue when trying to remove
water off my car. My year is 2014",1.0
scratches car,1.0
It was okay quality wise but nothing special amd for the price i think a bit pricey than other amzon basics items,1.0
didnt work for me,1.0
Did not work at all.,1.0
"What good is an organizer that can't keep its lid on? Wish I had been on top of this purchase/order and I would've sent it back. I put 2 of the 3 convert-a-hitch balls in this storage case & then placed it in a larger storage bin that I keep in the bed of my truck. Every time I open that larger storage bin, this little organizer has fallen apart & the balls are rolling around. Maybe the original designers thought we'd be using this piece of garbage to store cotton balls(?).",1.0
"Par for the course as Convert-a-ball is a loser of a company with ZERO R & D and no improvements over the years.  If I could give it a zero, I would.  The lid only has tiny catches on the long sides and it is cast out of limp plastic and the bulging sides don't grip the base so the lid pops off.  It should hinge and be attached permanently.  It is third one I have owned over the years and the only option.  They know it and abuse that fact in their lack of improvement.  If a company could just come along and do it right these guys would be history.  Lack of competition breeds complacency.",1.0
Makes you have to dry the truck with a regular towel anyways.  Doubles the work and stinks after a few uses.,1.0
"I had high hopes for this towel but it molds!

Does this soak up water? yes, very well
material: it does not feel like the shamwow or a fabric..feels more like a thick latex material

when it is dry it is very stiff, however, I have noticed that mold is growing on towel..I won't be using this again.",1.0
made of toxic material PVC,1.0
This does not work. Need another towel to dry the car after using this. Waste of money.,1.0
Feels like rubber and leaves marks on the car.,1.0
no ... it was not what I expected,1.0
"I am not sure whether or not I received a fake Absorber or not but its function did not live up to all the claims. My Absorber contracted mold/mildew within a few months of using, following instruction to let it sit in the container with some moisture. The Absorber also did not soak up water compared to advertisement. My Absorber leaves tons of water streak across the car's body, even when I laid it out flat and slowly pull on it. I tried to wash it, keep using it to see if it gets better, but to no avail. I am sure that it is a great product for some, but the one I received did nothing to soak up water.",1.0
"Generally I never give a one or two stars to items on Amazon, but in this case, one or two stars is a gift.  Yes, the item will absorb as advertised, but compared to other chammies, I am not so sure. The reason for a one star is that one cant wipe or clean up with this item; it will not go over any surface with out hanging up, twisting, etc.  I bought two of them and will return the other.  Don't waste your money.",1.0
It's very hard when it's not wet.,1.0
"Mildew even though it is ""mildew resistant""",1.0
Not good for autos...not very absorbent.,1.0
I'm sorry but is was not what I wanted. I was wanting something like a micro-fiber cloth....,1.0
Wet towel as directed it did not absorb all the water off the car and was almost like it was scraping against finish .,1.0
"First pulled us out of the package I was like, ""ooh, this feels nice"" then after you leave it out of the packaging it dries out and gets very stiff. First time I tried drying my car with that I felt like I had to get it wet first in order to even soften it up enough to use it over my car. Even after getting wet it still wasn't the same consistency as when I very first pulled it out of the package. And it did not do a good job of picking up the water, it was actually quite streaky. Needless to say, it's going in the trash. What a bummer.",1.0
I returned it.  Tried to use as a moisture barrier but it failed. Very disappointed.  Oh well.  Lose some win some.,1.0
